"Paper Title","Paper Link","Publication Year","Publication Type","Publication Title","Author Names","DOI","PDF Link","Abstract","TL;DR"
"Ai-assisted code generation and optimization: leveraging machine learning to enhance software development processes","https://scispace.com/paper/ai-assisted-code-generation-and-optimization-leveraging-xcjqdk08vd","2020","Journal Article","Deleted Journal","Swamy Prasadarao Velaga","10.26662/ijiert.v7i09.pp177-186","","The aim of this paper is to explore the AI-Driven Code Generation and Optimization. The continuous evolution of code generators has also opened up new possibilities for automating repetitive tasks, allowing for greater focus on high-level problem-solving and design rather than low-level implementation details. As technology continues to advance, the role of code generators in software development is expected to expand even further, offering innovative solutions to the challenges of tomorrow's computing landscape. Whether the ultimate vision is that of a programmer taking ""creative coding"" to the next level, the expert use of specialized DSLs, or automated software development, we believe that the pathway to practical realization is indeed in their enclosure [1]. Within this context, it is evident that the integration of AI methodologies and flex space technologies is a significant area of interest for researchers, as it presents numerous opportunities for continued innovation and advancement in the field. As we delve deeper into the intricacies of code generation and optimization techniques, it becomes increasingly apparent that further exploration and refinement are crucial in order to unlock the full potential of these cutting-edge AI-driven approaches. Additionally, the identification and proactive mitigation of challenges inherent in the convergence of AI and flex space are pivotal to ensuring the successful development and deployment of impactful solutions. Through a nuanced understanding of these critical domains, researchers and practitioners can work towards realizing the transformative possibilities that lie at the intersection of AI and flex space technologies [1]. By addressing the complexities and nuances associated with these advanced methodologies, we can facilitate the evolution of programming practices and software development processes, ultimately leading to the materialization of the envisioned creative and efficient computing ecosystems. ","By addressing the complexities and nuances associated with these advanced methodologies, researchers and practitioners can facilitate the evolution of programming practices and software development processes, ultimately leading to the materialization of the envisioned creative and efficient computing ecosystems."
"AI-driven software engineering","https://scispace.com/paper/ai-driven-software-engineering-3ra6h6g40q","2023","Journal Article","","Josh Mahmood Ali","10.54254/2977-3903/3/2023030","","The intersection of artificial intelligence (AI) and software engineering marks a transformative phase in the technology industry. This paper delves into AI-driven software engineering, exploring its methodologies, implications, challenges, and benefits. Drawing from data sources such as GitHub and Bitbucket and insights from industry experts, the study offers a comprehensive view of the current landscape. While the results indicate a promising uptrend in the integration of AI techniques in software development, challenges like model interpretability, ethical concerns, and integration complexities emerge as significant. Nevertheless, the transformative potential of AI within software engineering is profound, ushering in new paradigms of efficiency, innovation, and user experience. The study concludes by emphasizing the need for further research, better tooling, ethical guidelines, and education to fully harness the potential of AI-driven software engineering.","The study concludes by emphasizing the need for further research, better tooling, ethical guidelines, and education to fully harness the potential of AI-driven software engineering."
"Generative AI for Pull Request Descriptions: Adoption, Impact, and Developer Interventions","https://scispace.com/paper/generative-ai-for-pull-request-descriptions-adoption-impact-u1fsc6zqwbg9","2024","Repository","","Xiao Tao
Hata, Hideaki
Treude, Christoph
Matsumoto Ken-ichi","10.48550/arxiv.2402.08967","","GitHub's Copilot for Pull Requests (PRs) is a promising service aiming to automate various developer tasks related to PRs, such as generating summaries of changes or providing complete walkthroughs with links to the relevant code. As this innovative technology gains traction in the Open Source Software (OSS) community, it is crucial to examine its early adoption and its impact on the development process. Additionally, it offers a unique opportunity to observe how developers respond when they disagree with the generated content. In our study, we employ a mixed-methods approach, blending quantitative analysis with qualitative insights, to examine 18,256 PRs in which parts of the descriptions were crafted by generative AI. Our findings indicate that: (1) Copilot for PRs, though in its infancy, is seeing a marked uptick in adoption. (2) PRs enhanced by Copilot for PRs require less review time and have a higher likelihood of being merged. (3) Developers using Copilot for PRs often complement the automated descriptions with their manual input. These results offer valuable insights into the growing integration of generative AI in software development. ",""
"The Impact of AI on Developer Productivity: Evidence from GitHub Copilot","https://scispace.com/paper/the-impact-of-ai-on-developer-productivity-evidence-from-1dvksse7","2023","Journal Article","arXiv.org","Sida Peng
Eirini Kalliamvakou
Peter Cihon
Mert Demirer","10.48550/arXiv.2302.06590","","Generative AI tools hold promise to increase human productivity. This paper presents results from a controlled experiment with GitHub Copilot, an AI pair programmer. Recruited software developers were asked to implement an HTTP server in JavaScript as quickly as possible. The treatment group, with access to the AI pair programmer, completed the task 55.8% faster than the control group. Observed heterogenous effects show promise for AI pair programmers to help people transition into software development careers.","In this article , the authors present results from a controlled experiment with GitHub Copilot, an AI pair programmer, who was asked to implement an HTTP server in JavaScript as quickly as possible."
"The SPACE of AI: Real-World Lessons on AI's Impact on Developers","https://scispace.com/paper/the-space-of-ai-real-world-lessons-on-ai-s-impact-on-85gfxj97kxhx","2025","Journal Article","arXiv.org","Brian Houck
Travis Lowdermilk
Cody Beyer
Steven Clarke
Ben Hanrahan","10.48550/arxiv.2508.00178","","As artificial intelligence (AI) tools become increasingly embedded in software development workflows, questions persist about their true impact on developer productivity and experience. This paper presents findings from a mixed-methods study examining how developers perceive AI's influence across the dimensions of the SPACE framework: Satisfaction, Performance, Activity, Collaboration and Efficiency. Drawing on survey responses from over 500 developers and qualitative insights from interviews and observational studies, we find that AI is broadly adopted and widely seen as enhancing productivity, particularly for routine tasks. However, the benefits vary, depending on task complexity, individual usage patterns, and team-level adoption. Developers report increased efficiency and satisfaction, with less evidence of impact on collaboration. Organizational support and peer learning play key roles in maximizing AI's value. These findings suggest that AI is augmenting developers rather than replacing them, and that effective integration depends as much on team culture and support structures as on the tools themselves. We conclude with practical recommendations for teams, organizations and researchers seeking to harness AI's potential in software engineering.","This study examines AI's impact on developers' productivity and experience, finding AI enhances efficiency and satisfaction, particularly for routine tasks, but benefits vary by task complexity, usage, and team adoption, highlighting the importance of organizational support and peer learning."
"Enhancing Software Engineering with AI: Key Insights from ChatGPT","https://scispace.com/paper/enhancing-software-engineering-with-ai-key-insights-from-5jbupgxwfcx7","2024","Proceedings Article","","Ahmad Al‐Ahmad
Hasan Kahtan
Luay Tahat
Tarek Tahat","10.1109/dasa63652.2024.10836262","","Artificial intelligence (AI) is currently a prominent topic in the field of software engineering. AI has greatly transformed software engineering by providing advanced tools that may boost the effectiveness and efficiency of various stages of the system development life cycle. In this paper, we examine the role of AI by focusing primarily on ChatGPT, an OpenAI language model. The research explores how ChatGPT can assist in software engineering tasks such as code generation, bug fixing, and documentation development. Through an analysis of real-world scenarios, the case study highlights the benefits and challenges of using AI tools in these three areas. The findings show that although AI can accelerate the output and simplify processes, its application must be carefully considered because it has issues in terms of lack of context awareness regarding performance considerations, project-specific requirements, its inability to access real-time logs or inspect environments, and its tendency to produce documentation that doesn't capture the necessary details for complex systems.","This paper explores AI's role in software engineering, focusing on ChatGPT's capabilities in code generation, bug fixing, and documentation development, highlighting benefits and challenges, including context awareness and performance limitations."
"Artificial Intelligence in Software Development: A Review of Code Generation, Testing, Maintenance and Security","https://scispace.com/paper/artificial-intelligence-in-software-development-a-review-of-juinunehbvib","2025","Repository","","Ms. Prajakta Sudhir Khade
Dr. Rajeshkumar U. Sambhe","10.5281/zenodo.15173328","","&lt;h4&gt;Abstract :&lt;/h4&gt; &lt;p&gt;Artificial Intelligence (AI) is transforming software development by automating key processes such as code generation, testing, maintenance, and security. AI-powered tools like OpenAI Codex, GitHub Copilot, and DeepMind AlphaCode are revolutionizing programming by enhancing efficiency, reducing errors, and accelerating development cycles. Similarly, AI-driven testing frameworks improve bug detection, security analysis, and software performance optimization. This review explores recent advancements in AI-driven software development, analyzing its benefits, challenges, and ethical considerations. Additionally, it examines AI&rsquo;s role in cybersecurity, low-code/no-code development, and workforce transformation. The paper concludes by discussing future research directions and the balance between automation and human oversight in AI-assisted software engineering.&lt;/p&gt; ",""
"In-IDE Code Generation from Natural Language: Promise and Challenges","https://scispace.com/paper/in-ide-code-generation-from-natural-language-promise-and-1s7u3sl3","2022","Journal Article","ACM Transactions on Software Engineering and Methodology","","10.1145/3487569","","A great part of software development involves conceptualizing or communicating the underlying procedures and logic that needs to be expressed in programs. One major difficulty of programming is turning concept into code , especially when dealing with the APIs of unfamiliar libraries. Recently, there has been a proliferation of machine learning methods for code generation and retrieval from natural language queries , but these have primarily been evaluated purely based on retrieval accuracy or overlap of generated code with developer-written code, and the actual effect of these methods on the developer workflow is surprisingly unattested. In this article, we perform the first comprehensive investigation of the promise and challenges of using such technology inside the PyCharm IDE, asking, “At the current state of technology does it improve developer productivity or accuracy, how does it affect the developer experience, and what are the remaining gaps and challenges?” To facilitate the study, we first develop a plugin for the PyCharm IDE that implements a hybrid of code generation and code retrieval functionality, and we orchestrate virtual environments to enable collection of many user events (e.g., web browsing, keystrokes, fine-grained code edits). We ask developers with various backgrounds to complete 7 varieties of 14 Python programming tasks ranging from basic file manipulation to machine learning or data visualization, with or without the help of the plugin. While qualitative surveys of developer experience are largely positive, quantitative results with regards to increased productivity, code quality, or program correctness are inconclusive. Further analysis identifies several pain points that could improve the effectiveness of future machine learning-based code generation/retrieval developer assistants and demonstrates when developers prefer code generation over code retrieval and vice versa. We release all data and software to pave the road for future empirical studies on this topic, as well as development of better code generation models. ","In this paper , a plugin for the PyCharm IDE implements a hybrid of code generation and code retrieval functionality, and orchestrate virtual environments to enable collection of many user events (e.g., web browsing, keystrokes, fine-grained code edits)."
"Exploring AI Innovations in Automated Software Source Code Generation: Progress, Hurdles, and Future Paths","https://scispace.com/paper/exploring-ai-innovations-in-automated-software-source-code-20twk0wn11","2024","Journal Article","Informatica","Ayman Odeh","10.31449/inf.v48i8.5291","",",",""
"The Effects of GitHub Copilot on Computing Students' Programming Effectiveness, Efficiency, and Processes in Brownfield Programming Tasks","https://scispace.com/paper/the-effects-of-github-copilot-on-computing-students-v3m81mb2yk5r","2025","Journal Article","","Shihab, Md. Istiak Hossain
Haque, Summit","10.48550/arxiv.2506.10051","","When graduates of computing degree programs enter the software industry, they will most likely join teams working on legacy code bases developed by people other than themselves. In these so-called brownfield software development settings, generative artificial intelligence (GenAI) coding assistants like GitHub Copilot are rapidly transforming software development practices, yet the impact of GenAI on student programmers performing brownfield development tasks remains underexplored. This paper investigates how GitHub Copilot influences undergraduate students' programming performance, behaviors, and understanding when completing brownfield programming tasks in which they add new code to an unfamiliar code base. We conducted a controlled experiment in which 10 undergraduate computer science students completed highly similar brownfield development tasks with and without Copilot in a legacy web application. Using a mixed-methods approach combining performance analysis, behavioral analysis, and exit interviews, we found that students completed tasks 35% faster (p &lt; 0.05) and made 50% more solution progress p (&lt; 0.05) when using Copilot. Moreover, our analysis revealed that, when using Copilot, students spent 11% less time manually writing code (p &lt; 0.05), and 12% less time conducting web searches (p &lt; 0.05), providing evidence of a fundamental shift in how they engaged in programming. In exit interviews, students reported concerns about not understanding how or why Copilot suggestions work. This research suggests the need for computing educators to develop new pedagogical approaches that leverage GenAI assistants' benefits while fostering reflection on how and why GenAI suggestions address brownfield programming tasks. Complete study results and analysis are presented at https://ghcopilot-icer.github.io/. ",""
"Code at the Speed of Thought: Exploring the Impact of AI on Coding Practices","https://scispace.com/paper/code-at-the-speed-of-thought-exploring-the-impact-of-ai-on-xj6at94u6vxv","2024","Journal Article","","","10.6084/m9.figshare.25664439","","This article examines the transformative impact of Artificial Intelligence (AI) on coding practices, focusing on AI-driven code generation and its integration within software development workflows. As AI technology evolves, its application in coding has transcended traditional task automation, becoming a crucial tool for enhancing productivity, fostering innovation, and facilitating a deeper integration between design and development phases. We explore the capabilities of AI coding tools, which range from automating mundane coding tasks to generating code from visual designs, thereby streamlining the transition from concept to functional software. The paper also addresses the dual-edged sword of AI integration, highlighting the potential challenges such as ethical concerns, data security, and the need for significant upskilling of the workforce. Through a comprehensive analysis, this manuscript offers insights into how AI is not only reshaping coding practices but also setting the stage for future advancements that could revolutionize software development. The findings emphasize AI's role as a catalyst for change, enhancing human capabilities and paving the way for more innovative, efficient, and collaborative development environments. This article contributes to the discourse on AI’s evolving role in technology, providing valuable perspectives for both practitioners and researchers in the field of software development and artificial intelligence.<br> ",""
"Evaluating the Code Quality of AI-Assisted Code Generation Tools: An
  Empirical Study on GitHub Copilot, Amazon CodeWhisperer, and ChatGPT","https://scispace.com/paper/evaluating-the-code-quality-of-ai-assisted-code-generation-5zgvpcim","2023","Posted Content","","","10.48550/arxiv.2304.10778","","Context: AI-assisted code generation tools have become increasingly prevalent in software engineering, offering the ability to generate code from natural language prompts or partial code inputs. Notable examples of these tools include GitHub Copilot, Amazon CodeWhisperer, and OpenAI's ChatGPT. Objective: This study aims to compare the performance of these prominent code generation tools in terms of code quality metrics, such as Code Validity, Code Correctness, Code Security, Code Reliability, and Code Maintainability, to identify their strengths and shortcomings. Method: We assess the code generation capabilities of GitHub Copilot, Amazon CodeWhisperer, and ChatGPT using the benchmark HumanEval Dataset. The generated code is then evaluated based on the proposed code quality metrics. Results: Our analysis reveals that the latest versions of ChatGPT, GitHub Copilot, and Amazon CodeWhisperer generate correct code 65.2%, 46.3%, and 31.1% of the time, respectively. In comparison, the newer versions of GitHub CoPilot and Amazon CodeWhisperer showed improvement rates of 18% for GitHub Copilot and 7% for Amazon CodeWhisperer. The average technical debt, considering code smells, was found to be 8.9 minutes for ChatGPT, 9.1 minutes for GitHub Copilot, and 5.6 minutes for Amazon CodeWhisperer. Conclusions: This study highlights the strengths and weaknesses of some of the most popular code generation tools, providing valuable insights for practitioners. By comparing these generators, our results may assist practitioners in selecting the optimal tool for specific tasks, enhancing their decision-making process. ","In this article , the authors compared the performance of three code generation tools in terms of code quality metrics, such as Code Validity, Code Correctness, Code Security, Code Reliability and Code Maintainability, to identify their strengths and shortcomings."
"Demystifying Practices, Challenges and Expected Features of Using GitHub Copilot","https://scispace.com/paper/demystifying-practices-challenges-and-expected-features-of-ed8m3m0bsd","2023","Journal Article","International Journal of Software Engineering and Knowledge Engineering","Beiqi Zhang
Peng Liang
Xiao‐Qiu Zhou
Aakash Ahmad
Muhammad Waseem","10.1142/s0218194023410048","","With the advances in machine learning, there is a growing interest in AI-enabled tools for autocompleting source code. GitHub Copilot, also referred to as the “AI Pair Programmer”, has been trained on billions of lines of open source GitHub code, and is one of such tools that has been increasingly used since its launch in June 2021. However, little effort has been devoted to understanding the practices, challenges, and expected features of using Copilot in programming for auto-completed source code from the point of view of practitioners. To this end, we conducted an empirical study by collecting and analyzing the data from Stack Overflow (SO) and GitHub Discussions. More specifically, we searched and manually collected 303 SO posts and 927 GitHub discussions related to the usage of Copilot. We identified the programming languages, Integrated Development Environments (IDEs), technologies used with Copilot, functions implemented, benefits, limitations, and challenges when using Copilot. The results show that when practitioners use Copilot: (1) The major programming languages used with Copilot are JavaScript and Python, (2) the main IDE used with Copilot is Visual Studio Code, (3) the most common used technology with Copilot is Node.js, (4) the leading function implemented by Copilot is data processing, (5) the main purpose of users using Copilot is to help generate code, (6) the significant benefit of using Copilot is useful code generation, (7) the main limitation encountered by practitioners when using Copilot is difficulty of integration, and (8) the most common expected feature is that Copilot can be integrated with more IDEs. Our results suggest that using Copilot is like a double-edged sword, which requires developers to carefully consider various aspects when deciding whether or not to use it. Our study provides empirically grounded foundations that could inform software developers and practitioners, as well as provide a basis for future investigations on the role of Copilot as an AI pair programmer in software development. ","The use of GitHub Copilot for auto-completed source code generates a mixed bag of benefits and challenges. The tool is widely used for code generation, but integration difficulties and the need for more IDE integrations are common concerns."
"Generative Artificial Intelligence for Software Engineering—A Research Agenda","https://scispace.com/paper/generative-artificial-intelligence-for-software-engineering-oo0cug02zssq","2025","Journal Article","Software - Practice and Experience","Anh Nguyen‐Duc
Beatriz Cabrero‐Daniel
Adam Przybyłek
Chetan Arora
Dron Khanna
Tomas Herda
Usman Rafiq
Jorge Melegati
Eduardo Guerra
Kai‐Kristian Kemell
Mika Saari
Zheying Zhang
Huy Quoc Le
Tho Quan
Pekka Abrahamsson","10.1002/spe.70005","","ABSTRACT Context Generative artificial intelligence (GenAI) tools have become increasingly prevalent in software development, offering assistance to various managerial and technical project activities. Notable examples of these tools include OpenAI's ChatGPT, GitHub Copilot, and Amazon CodeWhisperer. Objective Although many recent publications have explored and evaluated the application of GenAI, a comprehensive understanding of the current development, applications, limitations, and open challenges remains unclear to many. Particularly, we do not have an overall picture of the current state of GenAI technology in practical software engineering usage scenarios. Method We conducted a literature review and focus groups for a duration of five months to develop a research agenda on GenAI for software engineering. Results We identified 78 open research questions (RQs) in 11 areas of software engineering. Our results show that it is possible to explore the adoption of GenAI in partial automation and support decision‐making in all software development activities. While the current literature is skewed toward software implementation, quality assurance and software maintenance, other areas, such as requirements engineering, software design, and software engineering education, would need further research attention. Common considerations when implementing GenAI include industry‐level assessment, dependability and accuracy, data accessibility, transparency, and sustainability aspects associated with the technology. Conclusions GenAI is bringing significant changes to the field of software engineering. Nevertheless, the state of research on the topic still remains immature. We believe that this research agenda holds significance and practical value for informing both researchers and practitioners about current applications and guiding future research. ","This research agenda identifies 78 open questions in 11 areas of software engineering, highlighting GenAI's potential for partial automation and decision-making support in software development, but also emphasizing the need for further research in areas like requirements engineering and software design."
