"Paper Title","Paper Link","Publication Year","Publication Type","Publication Title","Author Names","DOI","PDF Link","Abstract","TL;DR"
"Vibe Coding in Practice: Motivations, Challenges, and a Future Outlook -- a Grey Literature Review","https://scispace.com/paper/vibe-coding-in-practice-motivations-challenges-and-a-future-uf7yln1bo1zc","2025","Journal Article","","Fawzy Ahmed
Tahir, Amjed
Blincoe, Kelly","10.48550/arxiv.2510.00328","","AI code generation tools are transforming software development, especially for novice and non-software developers, by enabling them to write code and build applications faster and with little to no human intervention. Vibe coding is the practice where users rely on AI code generation tools through intuition and trial-and-error without necessarily understanding the underlying code. Despite widespread adoption, no research has systematically investigated why users engage in vibe coding, what they experience while doing so, and how they approach quality assurance (QA) and perceive the quality of the AI-generated code. To this end, we conduct a systematic grey literature review of 101 practitioner sources, extracting 518 firsthand behavioral accounts about vibe coding practices, challenges, and limitations. Our analysis reveals a speed-quality trade-off paradox, where vibe coders are motivated by speed and accessibility, often experiencing rapid ``instant success and flow'', yet most perceive the resulting code as fast but flawed. QA practices are frequently overlooked, with many skipping testing, relying on the models' or tools' outputs without modification, or delegating checks back to the AI code generation tools. This creates a new class of vulnerable software developers, particularly those who build a product but are unable to debug it when issues arise. We argue that vibe coding lowers barriers and accelerates prototyping, but at the cost of reliability and maintainability. These insights carry implications for tool designers and software development teams. Understanding how vibe coding is practiced today is crucial for guiding its responsible use and preventing a broader QA crisis in AI-assisted development. ",""
"Do Generative AI Tools Ensure Green Code? An Investigative Study","https://scispace.com/paper/do-generative-ai-tools-ensure-green-code-an-investigative-sf5m3tug0vhd","2025","Journal Article","","Mehra Rohit
Sharma, Vibhu Saujanya
Kaulgud, Vikrant
Podder Sanjay
Burden, Adam P.","10.48550/arxiv.2506.08790","","Software sustainability is emerging as a primary concern, aiming to optimize resource utilization, minimize environmental impact, and promote a greener, more resilient digital ecosystem. The sustainability or ""greenness"" of software is typically determined by the adoption of sustainable coding practices. With a maturing ecosystem around generative AI, many software developers now rely on these tools to generate code using natural language prompts. Despite their potential advantages, there is a significant lack of studies on the sustainability aspects of AI-generated code. Specifically, how environmentally friendly is the AI-generated code based upon its adoption of sustainable coding practices? In this paper, we present the results of an early investigation into the sustainability aspects of AI-generated code across three popular generative AI tools - ChatGPT, BARD, and Copilot. The results highlight the default non-green behavior of tools for generating code, across multiple rules and scenarios. It underscores the need for further in-depth investigations and effective remediation strategies. ",""
"AI-powered DevOps: the Software Industry Is Re-wiring the Pipeline","https://scispace.com/paper/ai-powered-devops-the-software-industry-is-re-wiring-the-bo7g7q6i6ce0","2025","Journal Article","ACM Sigsoft Software Engineering Notes","Ahmed El-Deeb","10.1145/3772008.3772011","","If you ask any software professional what's keeping the software industry busy these months, they will say AI. But what about AI? Most professionals not involved directly in AI-driven project have the impression that it's about ''using AI to layoff people'', they may say. The reality is more technical than that and it's more concerned about productivity and how to do more with available resources. The main topic of AI is modeling the entire software production pipeline and adding AI power to it. It is using AI to do actual work in the production of software. This is re-writing the entire pipeline. This paper explores this effort. ",""
"AI-Powered Software Development Life Cycle: From Requirements to Maintenance","https://scispace.com/paper/ai-powered-software-development-life-cycle-from-requirements-7l68g82uuiu6","2025","Journal Article","","Sandeep Burte
Sandeep Burte","10.64229/ykh1jf83","","The integration of artificial intelligence into software development represents a paradigmatic shift with profound implications for productivity, quality, and efficiency in modern software engineering practices. This viewpoint paper aims to examine the comprehensive application of generative AI technologies across all Software Development Life Cycle (SDLC) phases, analyze their transformative potential, and provide strategic insights for successful implementation. Through systematic analysis of recent empirical studies and practical implementations, we conducted a comprehensive review of AI applications spanning requirements analysis, system design, coding, testing, deployment, and maintenance phases. AI demonstrates significant capabilities in automating code generation, enhancing testing strategies, optimizing deployment processes, and enabling proactive maintenance approaches. Key applications include natural language processing for requirements refinement, intelligent architecture recommendations, comprehensive test suite generation, and predictive bug detection. Research Implications: Successful AI integration requires gradual implementation strategies, robust quality assurance mechanisms, and maintaining human oversight for critical decisions. Organizations must balance AI automation with human expertise, addressing ethical considerations and security concerns while fostering continuous learning approaches that align AI capabilities with organizational standards and domain-specific requirements. ",""
"Assessing the quality of GitHub copilot’s code generation","https://scispace.com/paper/assessing-the-quality-of-github-copilots-code-generation-3oowmzm5","2022","Proceedings Article","International Conference on Predictive Models in Software Engineering","Burak Yetistiren
Isik Ozsoy
E. Tuzun","10.1145/3558489.3559072","","The introduction of GitHub’s new code generation tool, GitHub Copilot, seems to be the first well-established instance of an AI pair-programmer. GitHub Copilot has access to a large number of open-source projects, enabling it to utilize more extensive code in various programming languages than other code generation tools. Although the initial and informal assessments are promising, a systematic evaluation is needed to explore the limits and benefits of GitHub Copilot. The main objective of this study is to assess the quality of generated code provided by GitHub Copilot. We also aim to evaluate the impact of the quality and variety of input parameters fed to GitHub Copilot. To achieve this aim, we created an experimental setup for evaluating the generated code in terms of validity, correctness, and efficiency. Our results suggest that GitHub Copilot was able to generate valid code with a 91.5% success rate. In terms of code correctness, out of 164 problems, 47 (28.7%) were correctly, while 84 (51.2%) were partially correctly, and 33 (20.1%) were incorrectly generated. Our empirical analysis shows that GitHub Copilot is a promising tool based on the results we obtained, however further and more comprehensive assessment is needed in the future.","In this article , the authors evaluate the quality of generated code provided by GitHub Copilot and evaluate the impact of the quality and variety of input parameters fed to the AI pair-programmer."
"Is GitHub Copilot a Substitute for Human Pair-programming? An Empirical Study","https://scispace.com/paper/is-github-copilot-a-substitute-for-human-pair-programming-an-iyfo332g","2022","Proceedings Article","","Saki Imai","10.1145/3510454.3522684","","This empirical study investigates the effectiveness of pair programming with GitHub Copilot in comparison to human pair-programming. Through an experiment with 21 participants we focus on code productivity and code quality. For experimental design, a participant was given a project to code, under three conditions presented in a randomized order. The conditions are pair-programming with Copilot, human pair-programming as a driver, and as a navigator. The codes generated from the three trials were analyzed to determine how many lines of code on average were added in each condition and how many lines of code on average were removed in the subsequent stage. The former measures the productivity of each condition while the latter measures the quality of the produced code. The results suggest that although Copilot increases productivity as measured by lines of code added, the quality of code produced is inferior by having more lines of code deleted in the subsequent trial.","The results suggest that although Copilot increases productivity as measured by Lines of code added, the quality of code produced is inferior by having more lines of code deleted in the subsequent trial."
"Reading Between the Lines: Modeling User Behavior and Costs in AI-Assisted Programming","https://scispace.com/paper/reading-between-the-lines-modeling-user-behavior-and-costs-32aaug20","2022","Journal Article","arXiv.org","Hussein Mozannar
Gagan Bansal
Adam Fourney
Eric Horvitz","10.48550/arXiv.2210.14306","","Code-recommendation systems, such as Copilot and CodeWhisperer, have the potential to improve programmer productivity by suggesting and auto-completing code. However, to fully realize their potential, we must understand how programmers interact with these systems and identify ways to improve that interaction. To make progress, we studied GitHub Copilot, a code-recommendation system used by millions of programmers daily. We developed CUPS, a taxonomy of common programmer activities when interacting with Copilot. Our study of 21 programmers, who completed coding tasks and retrospectively labeled their sessions with CUPS, showed that CUPS can help us understand how programmers interact with code-recommendation systems, revealing inefficiencies and time costs. Our insights reveal how programmers interact with Copilot and motivate new interface designs and metrics.","This work studied GitHub Copilot, developed CUPS– a taxonomy of 12 programmer activities common to AI code completion systems, and conducted a study with 21 programmers who completed coding tasks and used the labeling tool to retrospectively label their sessions with CUPS."
"Generative AI for Software Engineering: Large Language Model-Driven Code Generation with Safety and Trust Assessment in Enterprise Development","https://scispace.com/paper/generative-ai-for-software-engineering-large-language-model-z3fh5evzha5q","2023","Journal Article","International journal of scientific research in computer science, engineering and information technology","Udaya Kumar Reddy Veeramreddygari","10.32628/cseit23906195","","This paper explores how large language models (LLMs) can streamline microservice development using Spring Boot by automating boilerplate code, enhancing API documentation, and suggesting design patterns. The methodology integrates GPT-3.5 and Codex models with Spring Boot development workflows through custom IDE plugins and CI/CD pipeline integration. A comprehensive case study involving enterprise application development demonstrates significant productivity gains, with 40% reduction in development time and 25% improvement in code quality metrics. The study includes evaluation of generated code quality, documentation accuracy, and developer productivity across multiple microservice development scenarios. Results show that LLM-assisted development maintains high code quality while substantially reducing repetitive programming tasks, establishing a foundation for AI-augmented software engineering practices in enterprise environments. ","This study explores the use of large language models (LLMs) to automate code generation, enhance API documentation, and suggest design patterns in Spring Boot microservice development, achieving 40% reduced development time and 25% improved code quality."
"Impact of the Availability of ChatGPT on Software Development: A
  Synthetic Difference in Differences Estimation using GitHub Data","https://scispace.com/paper/impact-of-the-availability-of-chatgpt-on-software-1fci7j2dem","2024","Preprint","","Alexander Q. Quispe
Rodrigo Grijalba","10.48550/arxiv.2406.11046","","Advancements in Artificial Intelligence, particularly with ChatGPT, have significantly impacted software development. Utilizing novel data from GitHub Innovation Graph, we hypothesize that ChatGPT enhances software production efficiency. Utilizing natural experiments where some governments banned ChatGPT, we employ Difference-in-Differences (DID), Synthetic Control (SC), and Synthetic Difference-in-Differences (SDID) methods to estimate its effects. Our findings indicate a significant positive impact on the number of git pushes, repositories, and unique developers per 100,000 people, particularly for high-level, general purpose, and shell scripting languages. These results suggest that AI tools like ChatGPT can substantially boost developer productivity, though further analysis is needed to address potential downsides such as low quality code and privacy concerns. ","ChatGPT significantly enhances software development efficiency, leading to increased number of git pushes, repositories, and unique developers per 100,000 people."
"Comparing Software Developers with ChatGPT: An Empirical Investigation","https://scispace.com/paper/comparing-software-developers-with-chatgpt-an-empirical-229x5xpx","2023","Journal Article","arXiv.org","Nathalia Nascimento
Paulo S. C. Alencar
Donald D. Cowan","10.48550/arXiv.2305.11837","","The advent of automation in particular Software Engineering (SE) tasks has transitioned from theory to reality. Numerous scholarly articles have documented the successful application of Artificial Intelligence to address issues in areas such as project management, modeling, testing, and development. A recent innovation is the introduction of ChatGPT, an ML-infused chatbot, touted as a resource proficient in generating programming codes and formulating software testing strategies for developers and testers respectively. Although there is speculation that AI-based computation can increase productivity and even substitute software engineers in software development, there is currently a lack of empirical evidence to verify this. Moreover, despite the primary focus on enhancing the accuracy of AI systems, non-functional requirements including energy efficiency, vulnerability, fairness (i.e., human bias), and safety frequently receive insufficient attention. This paper posits that a comprehensive comparison of software engineers and AI-based solutions, considering various evaluation criteria, is pivotal in fostering human-machine collaboration, enhancing the reliability of AI-based methods, and understanding task suitability for humans or AI. Furthermore, it facilitates the effective implementation of cooperative work structures and human-in-the-loop processes. This paper conducts an empirical investigation, contrasting the performance of software engineers and AI systems, like ChatGPT, across different evaluation metrics. The empirical study includes a case of assessing ChatGPT-generated code versus code produced by developers and uploaded in Leetcode.","In this paper , the authors conducted an empirical investigation, contrasting the performance of software engineers and AI systems, like ChatGPT, across different evaluation metrics, including energy efficiency, vulnerability, fairness, and safety."
"Evaluating the Code Quality of AI-Assisted Code Generation Tools: An Empirical Study on GitHub Copilot, Amazon CodeWhisperer, and ChatGPT","https://scispace.com/paper/evaluating-the-code-quality-of-ai-assisted-code-generation-21vbb8wd","2023","Journal Article","arXiv.org","Burak Yetistiren
Eray Tüzün","10.48550/arXiv.2304.10778","","Context: AI-assisted code generation tools have become increasingly prevalent in software engineering, offering the ability to generate code from natural language prompts or partial code inputs. Notable examples of these tools include GitHub Copilot, Amazon CodeWhisperer, and OpenAI's ChatGPT. Objective: This study aims to compare the performance of these prominent code generation tools in terms of code quality metrics, such as Code Validity, Code Correctness, Code Security, Code Reliability, and Code Maintainability, to identify their strengths and shortcomings. Method: We assess the code generation capabilities of GitHub Copilot, Amazon CodeWhisperer, and ChatGPT using the benchmark HumanEval Dataset. The generated code is then evaluated based on the proposed code quality metrics. Results: Our analysis reveals that the latest versions of ChatGPT, GitHub Copilot, and Amazon CodeWhisperer generate correct code 65.2%, 46.3%, and 31.1% of the time, respectively. In comparison, the newer versions of GitHub CoPilot and Amazon CodeWhisperer showed improvement rates of 18% for GitHub Copilot and 7% for Amazon CodeWhisperer. The average technical debt, considering code smells, was found to be 8.9 minutes for ChatGPT, 9.1 minutes for GitHub Copilot, and 5.6 minutes for Amazon CodeWhisperer. Conclusions: This study highlights the strengths and weaknesses of some of the most popular code generation tools, providing valuable insights for practitioners. By comparing these generators, our results may assist practitioners in selecting the optimal tool for specific tasks, enhancing their decision-making process.","In this paper , the authors compared the performance of three code generation tools in terms of code quality metrics, such as Code Validity, Code Correctness, Code Security, Code Reliability and Code Maintainability, to identify their strengths and shortcomings."
"AI-Driven DevOps Transformation: A Paradigm Shift in Software Development","https://scispace.com/paper/ai-driven-devops-transformation-a-paradigm-shift-in-software-3v1555mpv7","2024","Journal Article","","Milandeep Kour Bali
Akeel Ramadan Mehdi
HARIHARAN Hariharan","10.1109/icsadl61749.2024.00026","","Software development has undergone a paradigm change with the introduction of Artificial Intelligence (AI) into DevOps processes. This study examines the complex effects of AI on every stage of the software development lifecycle, from the creation of the code to its deployment and use. Through the viewpoint of “The Intelligent Evolution of Coding,” we explore how productivity benefits, traditional coding habits are being reshaped, and software is being strengthened against security risks thanks to AI-driven code creation and analysis. After that, the story switches to the revolutionary trip “From CI/CD to Autonomous Pipelines,” explaining how AI is streamlining software releases, improving pipelines for continuous integration and deployment, and encouraging development and operations teams to work together more effectively. The paper highlights the symbiotic connection that characterizes the future of software development by emphasizing the dynamic partnership between human knowledge and machine intelligence throughout this research. To fully realize the promise of AI-driven DevOps, businesses must negotiate this disruptive environment with careful attention to ethical implementation, workforce upskilling, and the development of learning ecosystems. In the end, the study imagines a world in which technological advancements enhance human potential, stimulating creativity, resiliency, and flexibility in the dynamic field of software development.","A world in which technological advancements enhance human potential, stimulating creativity, resiliency, and flexibility in the dynamic field of software development is imagined, in which businesses must negotiate this disruptive environment with careful attention to ethical implementation, workforce upskilling, and the development of learning ecosystems."
"AI-Driven Coding","https://scispace.com/paper/ai-driven-coding-r9e4wvvw8tss","2025","Journal Article","Advances in computational intelligence and robotics book series","Otmane Azeroual","10.4018/979-8-3373-5097-4.ch015","","The rapid rise of Artificial Intelligence (AI) has significantly impacted both education and software development, particularly in coding instruction. AI-powered tools like GitHub Copilot, ChatGPT, and intelligent tutoring systems are transforming traditional teaching methods by offering personalized learning, real-time feedback, and enhanced debugging. While these tools show promise in supporting novice programmers and improving coding skills, concerns exist about their potential to undermine critical cognitive skills like problem-solving and creativity. This chapter examines the effectiveness of AI-driven coding tools in achieving educational and professional goals, exploring their impact on cognitive development and workforce readiness. It also addresses the societal implications of AI in education, including algorithmic biases, tool accessibility, and ethical considerations. Through empirical research and case studies, this chapter provides a nuanced view of AI's role in shaping coding education and the software industry. ","This chapter examines the effectiveness of AI-driven coding tools in education, exploring their impact on cognitive development, workforce readiness, and societal implications, including algorithmic biases, accessibility, and ethics, through empirical research and case studies."
"Transforming Software Development with Generative AI: Empirical Insights
  on Collaboration and Workflow","https://scispace.com/paper/transforming-software-development-with-generative-ai-4nf7dxsc6w","2024","Preprint","","Rasmus Ulfsnes
Nils Brede Moe
Viktoria Stray
Marianne Skarpen","10.48550/arxiv.2405.01543","","Generative AI (GenAI) has fundamentally changed how knowledge workers, such as software developers, solve tasks and collaborate to build software products. Introducing innovative tools like ChatGPT and Copilot has created new opportunities to assist and augment software developers across various problems. We conducted an empirical study involving interviews with 13 data scientists, managers, developers, designers, and frontend developers to investigate the usage of GenAI. Our study reveals that ChatGPT signifies a paradigm shift in the workflow of software developers. The technology empowers developers by enabling them to work more efficiently, speed up the learning process, and increase motivation by reducing tedious and repetitive tasks. Moreover, our results indicate a change in teamwork collaboration due to software engineers using GenAI for help instead of asking co-workers which impacts the learning loop in agile teams. ","GenAI has fundamentally altered software development workflows, improving efficiency, learning, and collaboration."
"Role of GenAI in Automated Code Generation within DevOps Practices: Explore how Generative AI","https://scispace.com/paper/role-of-genai-in-automated-code-generation-within-devops-24tfbc54k1","2023","Journal Article","Online","Prachi Tembhekar
Munivel Devan
Jawaharbabu Jeyaraman","10.60087/jklst.vol2.n2.p512","","Artificial Intelligence (AI) is a pivotal domain within computer science, profoundly influencing the software development lifecycle, particularly during the implementation phase. Here, developers grapple with the task of translating software requirements and designs into executable code. Automated Code Generation (ACG) leveraging AI emerges as a promising solution in this context. The automation of code generation processes is gaining traction as a means to tackle diverse software development challenges while boosting productivity. This paper presents a thorough review and discourse on both traditional and AI-driven techniques employed in ACG, highlighting their respective challenges and constraints. Through an examination of pertinent literature, we identify various AI methodologies and algorithms utilized in ACG, extracting evaluation metrics such as Accuracy, Efficiency, Scalability, Correctness, Generalization, among others. These metrics serve as the basis for a comparative analysis of AI-driven ACG methods, delving into their applications, strengths, weaknesses, performance metrics, and future prospects.","AI-powered Automated Code Generation (ACG) streamlines software development by automating code translation from requirements and designs into executable code. It enhances productivity and tackles diverse challenges. The paper explores AI methodologies and algorithms employed in ACG, evaluating their strengths and weaknesses through metrics like Accuracy, Efficiency, Scalability, and Generalization."
