"Paper Title","Paper Link","Publication Year","Publication Type","Publication Title","Author Names","DOI","PDF Link","Abstract","TL;DR"
"The Impact of Large Language Models on Software Development Productivity: A Systematic Review and Critical Analysis","https://scispace.com/paper/the-impact-of-large-language-models-on-software-development-4shvofd29ggq","2025","Repository","","Patil Swaraj","10.5281/zenodo.17227991","","This paper presents a systematic review of the impact of Large Language Models (LLMs) on software development productivity. Since their widespread adoption in late 2022, LLM-powered coding assistants have been posited as revolutionary tools capable of delivering order-of-magnitude productivity gains. However, empirical evidence presents a complex and often contradictory picture. This review synthesizes findings from 37 peer-reviewed studies, industry case studies, and controlled experiments to analyze the multifaceted effects of LLMs across the software development lifecycle. We ground our analysis in established productivity frameworks, such as SPACE and DORA metrics, to provide a holistic assessment beyond simple output measures. Our findings reveal that while LLMs demonstrably accelerate specific tasks like boilerplate code generation and information retrieval, they also introduce significant risks, including degraded code quality, security vulnerabilities, increased cognitive load for verification, and a potential reduction in team collaboration. Notably, we explore the ""productivity paradox,"" where developers perceive significant efficiency gains even when objective measures indicate a slowdown. We conclude that the impact of LLMs is not a universal enhancement but a complex trade-off, heavily contingent on developer experience, task complexity, codebase size, and the quality of human-AI interaction. The paper identifies critical research gaps, particularly the need for longitudinal and team-based studies, and offers recommendations for practitioners on leveraging LLMs effectively while mitigating their inherent risks. ",""
"Measuring AI-Driven Developer Productivity in Agile Software Development Random Forest Regression Analysis of Performance Metrics and Tool Integration","https://scispace.com/paper/measuring-ai-driven-developer-productivity-in-agile-software-8afe7j7f7w9h","2025","Journal Article","Computer Science, Engineering and Technology","","10.46632/cset/3/3/12","","The rapid integration of generative artificial intelligence (AI) tools in software development has created an urgent need to understand their impact on developer productivity and project outcomes. By examining AI-driven performance metrics for agile software development, this research addresses the current gap in empirical evidence on the effectiveness of generative AI in handling complex, real-world software projects. Traditional productivity metrics such as lines of code (LOC), feature completion rates, and defect density are inadequate for measuring productivity in AI-assisted environments. The study proposes new metrics including AI-assisted code generation, accuracy in defect detection, reduced developer effort, improved code quality, and reduced cognitive load to better assess the transformative potential of AI tools such as Git Hub Co-pilot and Open AI Codex. The research explores how these tools are reshaping traditional development workflows by automating routine tasks, enabling early bug detection, and improving project management processes. By analysing data from code repositories, issue trackers, and collaboration tools, the study provides evidence-based insights into developer productivity patterns. The findings show that AI-powered development tools can significantly reduce manual effort, accelerate software delivery, and improve overall quality, while allowing developers to focus on high-level design and strategic problem-solving, ultimately addressing the productivity paradox in modern software engineering. ",""
"Role of Generative AI in Software Development","https://scispace.com/paper/role-of-generative-ai-in-software-development-4055aadnqg5l","2025","Journal Article","Indian Scientific Journal Of Research In Engineering And Management","","10.55041/ijsrem53791","","Abstract - Generative Artificial Intelligence (GenAI) has emerged as a transformative technology in software development, providing intelligent tools like GitHub Copilot, ChatGPT, and Amazon Code Whisperer. These tools assist developers in tasks such as code generation, bug detection, automated testing, refactoring, documentation, and project management, thereby improving productivity, accuracy, and accessibility. Currently, GenAI is integrated across multiple stages of software engineering—from requirements analysis and design to implementation and maintenance—allowing even less technically skilled professionals to contribute effectively. While these tools offer significant benefits, they also face challenges such as nondeterministic outputs, hallucinations, limited understanding of higher-level design principles, security risks, and dependency concerns. Despite these limitations, the current state of GenAI demonstrates its potential to complement human developers, accelerate development cycles, and reduce repetitive workloads. Looking forward, the future scope of GenAI includes autonomous code generation, AI-assisted DevOps, improved integration with software architecture, and smarter project management, which can enable more sustainable, scalable, and intelligent software development. Moreover, GenAI has the potential to revolutionize collaborative software development by assisting teams in real-time code reviews and project coordination. Integration with cloud-based development environments and version control systems further increases accessibility and scalability. Finally, ethical considerations such as fairness, transparency, and accountability are becoming increasingly important as AI-driven software development expands. Keywords: Generative AI, Software Development, Automation, LLM, GitHub Copilot, ChatGPT, Code Whisperer ",""
"The role of generative AI in software development: Will it replace developers?","https://scispace.com/paper/the-role-of-generative-ai-in-software-development-will-it-nrb68jq5r6qm","2025","Repository","","","10.5281/zenodo.17263711","","Generative artificial intelligence is fundamentally transforming software development, automating routine tasks while reshaping developer roles and responsibilities within engineering teams. This article explores the impact of generative AI tools like GPT-4, Gemini, and GitHub Copilot on development practices through quantitative analysis across diverse technology companies. The implementation of these AI technologies has demonstrated significant productivity gains in code generation, debugging, refactoring, and testing, with some organizations reporting development cycle reductions exceeding 30%. However, substantial limitations persist in contextual understanding, security vulnerabilities, architectural decision-making, and code maintainability that necessitate continued human oversight. The integration of AI has catalyzed the emergence of specialized roles focused on prompt engineering, AI validation, and governance frameworks. Rather than replacing developers, generative AI appears to be augmenting human capabilities by handling routine implementation tasks while enabling professionals to focus on higher-value activities requiring creativity, domain knowledge, and critical thinking. Case studies from leading companies reveal successful integration strategies that strategically leverage AI strengths while maintaining human judgment for complex or safety-critical components. This evidence-based assessment provides insights into how AI is reshaping software engineering and the implications for professional developers navigating this transformative paradigm shift. ",""
"The role of generative AI in software development: Will it replace developers?","https://scispace.com/paper/the-role-of-generative-ai-in-software-development-will-it-dge12ujqs2vb","2025","Journal Article","World Journal Of Advanced Research and Reviews","Bhargav Mallampati","10.30574/wjarr.2025.26.1.1387","","Generative artificial intelligence is fundamentally transforming software development, automating routine tasks while reshaping developer roles and responsibilities within engineering teams. This article explores the impact of generative AI tools like GPT-4, Gemini, and GitHub Copilot on development practices through quantitative analysis across diverse technology companies. The implementation of these AI technologies has demonstrated significant productivity gains in code generation, debugging, refactoring, and testing, with some organizations reporting development cycle reductions exceeding 30%. However, substantial limitations persist in contextual understanding, security vulnerabilities, architectural decision-making, and code maintainability that necessitate continued human oversight. The integration of AI has catalyzed the emergence of specialized roles focused on prompt engineering, AI validation, and governance frameworks. Rather than replacing developers, generative AI appears to be augmenting human capabilities by handling routine implementation tasks while enabling professionals to focus on higher-value activities requiring creativity, domain knowledge, and critical thinking. Case studies from leading companies reveal successful integration strategies that strategically leverage AI strengths while maintaining human judgment for complex or safety-critical components. This evidence-based assessment provides insights into how AI is reshaping software engineering and the implications for professional developers navigating this transformative paradigm shift. ","Generative AI transforms software development by automating routine tasks, increasing productivity, and reshaping developer roles, but substantial limitations persist, necessitating human oversight, and augmenting human capabilities rather than replacing developers."
"Generative AI and the Transformation of Software Development Practices","https://scispace.com/paper/generative-ai-and-the-transformation-of-software-development-y30adt7uiea6","2025","Journal Article","","","10.48550/arxiv.2510.10819","","Generative AI is reshaping how software is designed, written, and maintained. Advances in large language models (LLMs) are enabling new development styles - from chat-oriented programming and 'vibe coding' to agentic programming - that can accelerate productivity and broaden access. This paper examines how AI-assisted techniques are changing software engineering practice, and the related issues of trust, accountability, and shifting skills. We survey iterative chat-based development, multi-agent systems, dynamic prompt orchestration, and integration via the Model Context Protocol (MCP). Using case studies and industry data, we outline both the opportunities (faster cycles, democratized coding) and the challenges (model reliability and cost) of applying generative AI to coding. We describe new roles, skills, and best practices for using AI in a responsible and effective way. ",""
"Large language models in programming: a meta-analysis of tools, users, and human-computer interaction themes","https://scispace.com/paper/large-language-models-in-programming-a-meta-analysis-of-5c8xjh9nkwwb","2025","Journal Article","AHFE international","Daniel Olivares
Charles Bennington
Abigail Skillestad","10.54941/ahfe1006934","","Since 2021, the rapid integration of large language models (LLMs), such as OpenAI’s Codex and ChatGPT, into programming has reshaped how software is written, learned, and maintained. Tools such as GitHub Copilot, Amazon CodeWhisperer, Tabnine, and Sourcegraph Cody have evolved from experimental aids to core elements of modern workflows, while academic prototypes continue to explore new interfaces and teaching applications. This meta-analysis synthesizes empirical research, user evaluations, and product-level comparisons to provide a comprehensive view of the opportunities and challenges posed by LLM-based programming assistants. The analysis considers novice programmers, professional developers, researchers, and educators, highlighting recurring human-computer interaction (HCI) themes of trust calibration, cognitive load management, interface modalities, and the balance between automation and user control.The methodology followed a systematic review of studies published between 2021 and early 2025 in ACM, IEEE, arXiv, and other recognized repositories. Industry reports and tool documentation were included to capture emerging developments. A qualitative thematic synthesis integrated findings across varied research contexts, including user studies, classroom evaluations, and professional development workflows, revealing consistent patterns in tool use, learning outcomes, and professional practice, while also identifying gaps in current understanding.Novice programmers benefit from immediate feedback, reduced syntax errors, and increased confidence. Yet these advantages can foster over-reliance if tools are used as answer generators. Structured support, such as hint-based prompting and code validation, helps students engage more deeply with core concepts. Professional developers report productivity gains in routine tasks and code navigation but remain cautious about correctness, security, and workflow disruptions. Vulnerability checks, auto-generated tests, and explanation features are especially valued. Researchers and educators employ LLM-based programming tools to streamline analysis, generate assessments, and create interactive teaching methods, though concerns persist about equity, academic integrity, and responsible classroom use.Across all groups, four HCI themes stand out. trust calibration is essential to help users understand both strengths and limitations. Cognitive load management improves when tools integrate seamlessly into workflows and provide context-aware assistance. Interface modalities matter, with value in combining inline completions and conversational explanations to support varied scenarios. Finally, balancing automation with user control ensures accountability and promotes critical engagement, meaning that users remain actively involved in evaluating, verifying, and refining AI-generated outputs rather than passively accepting them.These findings show that LLM-based programming tools are not inherently harmful; outcomes depend on how they are used and designed. For learners, risks arise when practice is bypassed, limiting skill growth. For professionals, challenges involve accuracy, security, and workflow integration. Effective use treats LLMs as collaborators that support reflection and experimentation rather than replacements for human reasoning. Students benefit when tools provide hints and guidance instead of complete solutions, encouraging deeper understanding.In conclusion, LLM-based programming tools present strong potential for advancing productivity, education, and research. Benefits include faster coding, improved learning, and streamlined teaching. Persistent challenges remain related to correctness, cognitive load, and trust. Future research should emphasize longitudinal studies of skill development and design strategies that improve transparency, context, and pedagogy. Ethical and legal considerations, including attribution, privacy, and access, must also be addressed. By positioning these tools as collaborative partners, the computing community can maximize their benefits while reducing risks for developers, educators, and researchers. ","This meta-analysis examines the impact of large language models on programming, highlighting benefits (faster coding, improved learning) and challenges (correctness, cognitive load, trust) across novice programmers, professionals, and educators, emphasizing the need for effective design and use strategies."
"The Impact of LLM-Assistants on Software Developer Productivity: A Systematic Literature Review","https://scispace.com/paper/the-impact-of-llm-assistants-on-software-developer-vtfbqsvf4c69","2025","Journal Article","arXiv.org","Amr Mohamed
Maram Assi
Mariam Guizani","10.48550/arxiv.2507.03156","","Large language model assistants (LLM-assistants) present new opportunities to transform software development. Developers are increasingly adopting these tools across tasks, including coding, testing, debugging, documentation, and design. Yet, despite growing interest, there is no synthesis of how LLM-assistants affect software developer productivity. In this paper, we present a systematic literature review of 37 peer-reviewed studies published between January 2014 and December 2024 that examine this impact. Our analysis reveals that LLM-assistants offer both considerable benefits and critical risks. Commonly reported gains include minimized code search, accelerated development, and the automation of trivial and repetitive tasks. However, studies also highlight concerns around cognitive offloading, reduced team collaboration, and inconsistent effects on code quality. While the majority of studies (92%) adopt a multi-dimensional perspective by examining at least two SPACE dimensions, reflecting increased awareness of the complexity of developer productivity, only 14% extend beyond three dimensions, indicating substantial room for more integrated evaluations. Satisfaction, Performance, and Efficiency are the most frequently investigated dimensions, whereas Communication and Activity remain underexplored. Most studies are exploratory (64%) and methodologically diverse, but lack longitudinal and team-based evaluations. This review surfaces key research gaps and provides recommendations for future research and practice. All artifacts associated with this study are publicly available at https://zenodo.org/records/15788502.","This systematic literature review of 37 studies (2014-2024) examines the impact of Large Language Model (LLM) assistants on software developer productivity, revealing benefits (minimized code search, accelerated development) and risks (cognitive offloading, reduced team collaboration)."
"Human-AI Pair Programming: Evaluating Trust, Efficiency, and Defect Incidence","https://scispace.com/paper/human-ai-pair-programming-evaluating-trust-efficiency-and-3coytp3tmf42","2025","Repository","","Arjun Deshraje Urs","10.5281/zenodo.16501130","","The advent of human-AI pair programming, characterized by collaborative interactions between developers and intelligent code assistants such as GitHub Copilot and Amazon CodeWhisperer, represents a pivotal shift in software engineering practices. This study presents an empirical investigation into the influence of these AI copilots on trust calibration, task efficiency, error proliferation, and the onboarding of software engineers. Utilizing a mixed-methods approach with 72 participants across three experience levels, we conducted a within-subjects experiment comparing solo programming with AI-assisted development. While AI copilots enhance code generation velocity by 19.7% on average, they concurrently increase defect rates by 71% among novice developers (p < 0.001). These insights illuminate pathways toward the design of more reliable, interpretable AI assistants and highlight the need for experience-dependent training approaches. ",""
"Human-AI Pair Programming: Evaluating Trust, Efficiency, and Defect Incidence","https://scispace.com/paper/human-ai-pair-programming-evaluating-trust-efficiency-and-md21zykrv9ky","2025","Repository","","Arjun Deshraje Urs","10.5281/zenodo.16501129","","The advent of human-AI pair programming, characterized by collaborative interactions between developers and intelligent code assistants such as GitHub Copilot and Amazon CodeWhisperer, represents a pivotal shift in software engineering practices. This study presents an empirical investigation into the influence of these AI copilots on trust calibration, task efficiency, error proliferation, and the onboarding of software engineers. Utilizing a mixed-methods approach with 72 participants across three experience levels, we conducted a within-subjects experiment comparing solo programming with AI-assisted development. While AI copilots enhance code generation velocity by 19.7% on average, they concurrently increase defect rates by 71% among novice developers (p < 0.001). These insights illuminate pathways toward the design of more reliable, interpretable AI assistants and highlight the need for experience-dependent training approaches. ","This study evaluates human-AI pair programming, finding AI copilots enhance code generation velocity by 19.7% but increase defect rates by 71% among novice developers, highlighting the need for experience-dependent training approaches and more reliable AI assistants."
"Copilot Impact Studies: Measuring Productivity, Trust, and Skill Evolution in Enterprise Developer Teams","https://scispace.com/paper/copilot-impact-studies-measuring-productivity-trust-and-lc0tj855nk0j","2025","Journal Article","International journal of computational and experimental science and engineering","Madhuri Koripalli","10.22399/ijcesen.4217","","The incorporation of artificial intelligence-driven coding assistants in enterprise software development is a paradigmatic shift in the way development teams think and implement technical solutions. This article examines the many-sided effects of AI copilot technology on developer productivity, trust calibration, and skill development in different enterprise contexts. By using a mixed-methods paradigm that integrates quantitative performance data with qualitative data derived from developer experiences, findings show a multifaceted reality where productivity improvements occur in an uneven pattern across task types and levels of experience. Although routine implementation tasks reveal hn≤icated that subjects who had been given an AI assistant tended to generate incorrect and insecure solutions to cryptography problems, with those who were provided with the assistant writing substantially less secure code (p = 0.05) and tending to be more confident in their insecure solutions (p &lt; 0.001) [2]. Additionally, the enterprise environment provides special considerations related to security, compliance, and intellectual property that distinguish it from open-source or startup environments on which much of the current research has been performed. ","This study examines the impact of AI copilot technology on enterprise developer teams, finding mixed results on productivity, trust, and skill development, with uneven improvements across task types and experience levels, and potential security concerns in certain contexts."
"AI-assisted Programming May Decrease the Productivity of Experienced Developers by Increasing Maintenance Burden","https://scispace.com/paper/ai-assisted-programming-may-decrease-the-productivity-of-o1rqyij1qbu2","2025","Journal Article","","Xu Feiyang
Feiyang
Xu","10.48550/arxiv.2510.10165","","Generative AI solutions like GitHub Copilot have been shown to increase the productivity of software developers. Yet prior work remains unclear on the quality of code produced and the challenges of maintaining it in software projects. If quality declines as volume grows, experienced developers face increased workloads reviewing and reworking code from less-experienced contributors. We analyze developer activity in Open Source Software (OSS) projects following the introduction of GitHub Copilot. We find that productivity indeed increases. However, the increase in productivity is primarily driven by less-experienced (peripheral) developers. We also find that code written after the adoption of AI requires more rework. Importantly, the added rework burden falls on the more experienced (core) developers, who review 6.5% more code after Copilot's introduction, but show a 19% drop in their original code productivity. More broadly, this finding raises caution that productivity gains of AI may mask the growing burden of maintenance on a shrinking pool of experts. ",""
